,Date,Token,Datestamp,Speaker
87535,14-Nov-08,indeed run euro?s establishment experience past decade associated unprecedented degree policy coordination among sovereign states within euro area including cooperation areas fiscal regulatory policies well monetary policy,11/14/2008,Chairman Ben S. Bernanke
87536,14-Nov-08,euro?s introduction remarkable achievement,11/14/2008,Chairman Ben S. Bernanke
87537,14-Nov-08,academic bit consulting european monetary institute european central bank?s ecb predecessor monetary transmission mechanisms thus played part albeit extremely small one grand project,11/14/2008,Chairman Ben S. Bernanke
87538,14-Nov-08,credit squeeze turn principal cause economic slowdown taking place many countries,11/14/2008,Chairman Ben S. Bernanke
87539,14-Nov-08,unwinding boom associated financial losses led withdrawal many investors credit markets deleveraging financial institutions acted constrict available credit households businesses,11/14/2008,Chairman Ben S. Bernanke
87540,14-Nov-08,however fundamentally turmoil product global credit boom characterized broad underpricing risk excessive leverage financial institutions increasing reliance complex opaque financial instruments proven fragile stress,11/14/2008,Chairman Ben S. Bernanke
87541,14-Nov-08,proximate cause financial turmoil end us housing boom attendant losses mortgages mortgage related assets many institutions,11/14/2008,Chairman Ben S. Bernanke
87542,14-Nov-08,know financial markets remain severe strain,11/14/2008,Chairman Ben S. Bernanke
87543,14-Nov-08,mention reminder creators euro drew monetary expertise around world early example international cooperation since proven one hallmarks ecb,11/14/2008,Chairman Ben S. Bernanke
87544,14-Nov-08,example regulatory capacity federal reserve worked closely regulators supervisors number european nations active participants international financial stability forum standard setting bodies operating aegis bank international settlements,11/14/2008,Chairman Ben S. Bernanke
87545,14-Nov-08,current financial crisis global economic slowdown likewise occasion unprecedented international policy coordination within europe also globally,11/14/2008,Chairman Ben S. Bernanke
87546,14-Nov-08,focus today however cooperation monetary policy especially meeting liquidity needs increasingly globalized financial markets,11/14/2008,Chairman Ben S. Bernanke
87547,14-Nov-08,efforts central banks around world increase availability liquidity along steps taken central banks governments contributed tentative improvements credit market functioning,11/14/2008,Chairman Ben S. Bernanke
87548,14-Nov-08,elsewhere including canada euro area united kingdom central banks introduced expanded similar measures boost provision liquidity local currencies,11/14/2008,Chairman Ben S. Bernanke
87549,14-Nov-08,however continuing volatility markets recent indicators economic performance confirm challenges remain,11/14/2008,Chairman Ben S. Bernanke
87550,14-Nov-08,reason policymakers remain close contact monitor developments closely stand ready take additional steps conditions warrant,11/14/2008,Chairman Ben S. Bernanke
87551,14-Nov-08,times like especially aware importance close working relationships central bank colleagues around world,11/14/2008,Chairman Ben S. Bernanke
87552,14-Nov-08,relationships fostered ties established forums like one many venues policymakers regularly gather,11/14/2008,Chairman Ben S. Bernanke
87553,14-Nov-08,th anniversary euro opportunity celebrate impressive historic achievement also reaffirm commitment cooperation address challenges increasingly integrated global economy,11/14/2008,Chairman Ben S. Bernanke
87554,14-Nov-08,central bankers policymakers around world must continue work together address disruptions credit markets promote vibrant global economy,11/14/2008,Chairman Ben S. Bernanke
87555,14-Nov-08,central bankers working closely together throughout period financial turmoil,11/14/2008,Chairman Ben S. Bernanke
87556,14-Nov-08,personally found opportunity share views regularly president trichet leading central bankers various international meetings extremely valuable,11/14/2008,Chairman Ben S. Bernanke
87557,14-Nov-08,domestic central bank also typically best informed quality collateral offered potential borrowers,11/14/2008,Chairman Ben S. Bernanke
87558,14-Nov-08,arrangement makes use fact domestic central bank best positioned understand mechanics special features country?s financial payments systems existing relationships domestic financial institutions best assess strength institution needs foreign currency liquidity,11/14/2008,Chairman Ben S. Bernanke
87559,14-Nov-08,swap agreements responsibility allocating foreign currency liquidity within jurisdiction lies domestic central bank,11/14/2008,Chairman Ben S. Bernanke
87560,14-Nov-08,also reflects importance relationships central banks institutions serve,11/14/2008,Chairman Ben S. Bernanke
87561,14-Nov-08,frequent contact phone well,11/14/2008,Chairman Ben S. Bernanke
87562,14-Nov-08,consultations allow us keep abreast developments countries compare analyses developing trends draw other?s experience knowledge,11/14/2008,Chairman Ben S. Bernanke
87563,14-Nov-08,merits coordinated monetary policies discussed policymakers academics decades practice coordination quite rare,11/14/2008,Chairman Ben S. Bernanke
87564,14-Nov-08,however october federal reserve announced reduction policy interest rate jointly five major central banks bank canada bank england ecb sveriges riksbank swiss national bank snb bank japan expressing support,11/14/2008,Chairman Ben S. Bernanke
87565,14-Nov-08,last month?s joint action motivated abatement inflationary pressures increased indications economic slowing respective economies,11/14/2008,Chairman Ben S. Bernanke
87566,14-Nov-08,federal reserve responded strong demand funding banks primary dealers dramatically increasing amount term funding auctions banks providing new lending facilities nonbanks supplying high quality securities use repurchase agreement repo markets collateralized lending funding purchases commercial paper,11/14/2008,Chairman Ben S. Bernanke
87567,14-Nov-08,skip main navigation skip secondary navigation skip content new · next · site map · z index · careers · rss · videos · current faqs · contact us search advanced search aboutthe fed news events monetarypolicy bankinginformation regulation paymentsystems economicresearch data consumer information communitydevelopment reportingforms publications skip content buildmenu menu home news events speeches print speech chairman ben bernanke fifth european central bank central banking conference euro ten lessons challenges frankfurt germany november policy coordination among central banks pleased frankfurt today celebrate th anniversary euro,11/14/2008,Chairman Ben S. Bernanke
87568,14-Nov-08,notably mid october federal reserve eliminated limits sizes swap lines ecb bank england snb bank japan accommodate demands us dollar funding scale,11/14/2008,Chairman Ben S. Bernanke
87569,14-Nov-08,addition coordinated rate cut intended send strong signal public markets resolve act together address global economic challenges,11/14/2008,Chairman Ben S. Bernanke
87570,14-Nov-08,although range mechanisms used broad provision liquidity conforms central bank?s traditional role lender last resort,11/14/2008,Chairman Ben S. Bernanke
87571,14-Nov-08,however novel aspect current situation balance sheets financial institutions increasingly come include instruments denominated foreign currencies,11/14/2008,Chairman Ben S. Bernanke
87572,14-Nov-08,need currencies outside issuing country?s markets arises primarily global role played key international currencies dollar euro,11/14/2008,Chairman Ben S. Bernanke
87573,14-Nov-08,example past decade international loans deposits grown tremendously issuance international debt securities bonds notes money market instruments sold outside borders borrower?s country sometimes denominated foreign currencies,11/14/2008,Chairman Ben S. Bernanke
87574,14-Nov-08,developments posed new challenges conventional central bank liquidity lender last resort policies,11/14/2008,Chairman Ben S. Bernanke
87575,14-Nov-08,example injecting euros sterling national money markets may sufficient restore market function economies funding shortages dollars,11/14/2008,Chairman Ben S. Bernanke
87576,14-Nov-08,steps consistent principles agreed group seven finance ministers central bank governors october communiqué,11/14/2008,Chairman Ben S. Bernanke
87577,14-Nov-08,many financial institutions outside united states especially europe substantially increased dollar investments recent years including loans nonbanks purchases asset backed securities issued us residents also continued prominent role dollar international trade foreign direct investment financial transactions contributes dollar funding needs abroad,11/14/2008,Chairman Ben S. Bernanke
87578,14-Nov-08,recent sharp deterioration conditions funding markets left participants outside united states without adequate access short term dollar financing,11/14/2008,Chairman Ben S. Bernanke
87579,14-Nov-08,emergence dollar funding shortages around globe required internationally coordinated approach among central banks lender last resort function,11/14/2008,Chairman Ben S. Bernanke
87580,14-Nov-08,principal tool used currency swap line allows collaborating central bank draw balances denominated foreign partner?s currency,11/14/2008,Chairman Ben S. Bernanke
87581,14-Nov-08,federal reserve established temporary swap lines dozen central banks many central banks drawn lines using variety methods facilities allocated funds meet needs institutions within borders although funding needs current turmoil pronounced dollars arisen currencies well,11/14/2008,Chairman Ben S. Bernanke
87582,14-Nov-08,example ecb set swap lines repo facilities central banks denmark hungary provide euro liquidity countries,11/14/2008,Chairman Ben S. Bernanke
87583,14-Nov-08,know however monetary policy actions resolved ongoing strains financial markets including interbank funding markets,11/14/2008,Chairman Ben S. Bernanke
87584,14-Nov-08,financial institutions outside united states relied dollars acquired us affiliates many others relied interbank wholesale markets obtain dollars,11/14/2008,Chairman Ben S. Bernanke
87585,14-Nov-08,addition measures governments many countries broadened deposit insurance coverage announced plans inject capital banking systems guarantee bank debts,11/14/2008,Chairman Ben S. Bernanke
87586,14-Nov-08,indeed significant feature recent financial market stress strong demand dollar funding united states also abroad,11/14/2008,Chairman Ben S. Bernanke
87587,14-Nov-08,collaborative approach injection liquidity reflects global multi currency nature funding difficulties,11/14/2008,Chairman Ben S. Bernanke
87588,14-Nov-08,terms many swap agreements adjusted changing needs liquidity sizes swaps increased types collateral accepted central banks financial institutions economies expanded maturities funds made available tailored meeting prevailing needs,11/14/2008,Chairman Ben S. Bernanke
87589,14-Nov-08,taken together actions helped improve distribution liquidity around globe,11/14/2008,Chairman Ben S. Bernanke
